Material Document;Posting Date;Plant;Material;Short Text;Quantity;Unit;Net Value;Vendor;Movement Type
4900123456;15.01.2025;1000;MAT-FUEL-001;Diesel fuel fleet vehicles;1250,50;L;1875,75;100234;201
4900123457;16.01.2025;2000;MAT-FUEL-002;Heating oil storage tank;890;L;1246,00;100234;201
4900123458;18.01.2025;US01;MAT-FUEL-003;Gasoline company cars;45,2;GAL;198,50;200891;201
4900123459;20.01.2025;1000;MAT-PROC-440;Steel sheet procurement Q1;12,5;TO;45000,00;300112;101
4900123460;22.01.2025;9999;MAT-FUEL-001;Diesel fuel fleet vehicles;500;L;750,00;100234;201
4900123461;25.01.2025;1000;MAT-SVC-001;IT consulting services annual;1;EA;120000,00;400556;101
4900123462;28.01.2025;2000;MAT-FUEL-004;Benzin Generator Notstrom;320;L;512,00;100234;201
